{
  "artifactId": "art-knowledge-snapshot-pre-planning",
  "artifactType": "KnowledgeSnapshot",
  "schemaVersion": "1.0.0",
  "workflowId": "pirunner-canonical",
  "taskId": "knowledge-sync",
  "agentId": "7432",
  "createdAt": "2026-10-04T23:56:00.000Z",
  "parentArtifactIds": ["baseline-1791144874449"],
  "sourceRefs": [
    {
      "type": "GIT",
      "identifier": "293ef0f192440525840f6d686b2c3e56cd96bba9"
    }
  ],
  "status": "ACCEPTED",
  "payload": {
    "repositoryIdentity": "hitm-workflow",
    "currentRevision": "293ef0f192440525840f6d686b2c3e56cd96bba9",
    "branch": "main",
    "workingTreeState": "CLEAN",
    "projectType": "typescript",
    "buildSystem": "npm",
    "dependencyLockHash": "97c4bab5e9a3bfe277322fbb497191fdb2f7999f8fc68e8ad87aaacef9c77dc5",
    "dependencyLockValid": true,
    "testSuiteLocked": true,
    "testSuiteLockHash": "d4176a96a82e4b000056b704e9514c3b99037c6bd7d05405cf318671b416a997",
    "testSuiteLockedAt": "2026-10-04T13:51:48.332Z",
    "testResults": {
      "totalTests": 53,
      "passed": 53,
      "failed": 0,
      "skipped": 0,
      "testFiles": 15,
      "lastRun": "2026-10-04T23:55:39.000Z",
      "durationMs": 809
    },
    "sourceInventory": {
      "typeScriptFiles": 40,
      "root": "src",
      "structure": [
        "src/application/",
        "src/domain/",
        "src/infrastructure/"
      ]
    },
    "testInventory": {
      "testFiles": 15,
      "root": "tests",
      "structure": [
        "tests/application/",
        "tests/domain/",
        "tests/infrastructure/"
      ]
    },
    "specificationRefs": [
      {
        "type": "DOCUMENTATION",
        "identifier": "TECHSPEC.md",
        "status": "CURRENT"
      }
    ],
    "documentationRefs": [
      {
        "type": "FILE",
        "identifier": "README.md"
      },
      {
        "type": "FILE",
        "identifier": "USAGE.md"
      }
    ],
    "recentCommits": [
      {
        "hash": "293ef0f",
        "message": "Documentation Update"
      },
      {
        "hash": "8af9070",
        "message": "feat(compliance): complete MVP dogfooding authority, natural turn interception, and skill synthesis"
      },
      {
        "hash": "6916813",
        "message": "fix: documentation pass"
      }
    ],
    "unresolvedQuestions": [],
    "observations": [
      "Repository working tree is clean (no uncommitted source changes)",
      "All 53 tests passing across 15 test files",
      "Dependency lockfile hash matches baseline - no dependency drift",
      "Test suite lock is valid and unchanged",
      "Project follows hexagonal architecture pattern (application/domain/infrastructure layers)"
    ]
  }
}