{
  "artifactId": "art-sprintspecification-1791215429433",
  "artifactType": "SprintSpecification",
  "schemaVersion": "1.0.0",
  "workflowId": "pirunner-canonical",
  "taskId": "task-PLANNING",
  "agentId": "0036",
  "createdAt": "2026-10-05T15:50:29.433Z",
  "parentArtifactIds": [],
  "sourceRefs": [
    {
      "type": "SESSION",
      "identifier": "run-1791215429433"
    }
  ],
  "status": "SUBMITTED",
  "payload": {
    "masterSpecificationArtifactId": "art-spec",
    "sprintNumber": 1,
    "goals": [
      "Update project documentation (README.md and USAGE.md) to reflect current state and recent changes",
      "Generate appropriate conventional commit message and commit all uncommitted work"
    ],
    "tasks": [
      {
        "id": "TASK-1",
        "title": "Review all uncommitted changes to understand completed work scope",
        "requirementIds": [
          "REQ-DOC-001"
        ]
      },
      {
        "id": "TASK-2",
        "title": "Update README.md with current project state and recent changes",
        "requirementIds": [
          "REQ-DOC-001"
        ]
      },
      {
        "id": "TASK-3",
        "title": "Update USAGE.md with accurate, up-to-date usage instructions",
        "requirementIds": [
          "REQ-DOC-002"
        ]
      },
      {
        "id": "TASK-4",
        "title": "Craft conventional commit message summarizing all changes",
        "requirementIds": [
          "REQ-COMMIT-001"
        ]
      },
      {
        "id": "TASK-5",
        "title": "Stage and commit all changes with appropriate message",
        "requirementIds": [
          "REQ-COMMIT-001"
        ]
      }
    ],
    "acceptanceCriteria": [
      {
        "id": "AC-001",
        "statement": "README.md accurately reflects current project capabilities and recent changes"
      },
      {
        "id": "AC-002",
        "statement": "USAGE.md provides correct, up-to-date usage instructions matching current codebase"
      },
      {
        "id": "AC-003",
        "statement": "Commit message follows conventional commit format (feat/chore/docs prefix)"
      },
      {
        "id": "AC-004",
        "statement": "Commit message accurately summarizes the scope of all changes included"
      },
      {
        "id": "AC-005",
        "statement": "All uncommitted work is properly staged and included in the commit"
      },
      {
        "id": "AC-006",
        "statement": "git status shows clean working tree after commit completes"
      }
    ]
  }
}