{
  "artifactId": "art-sprintspecification-1791215372413",
  "artifactType": "SprintSpecification",
  "schemaVersion": "1.0.0",
  "workflowId": "pirunner-canonical",
  "taskId": "task-PLANNING",
  "agentId": "0036",
  "createdAt": "2026-10-05T15:49:32.413Z",
  "parentArtifactIds": [],
  "sourceRefs": [
    {
      "type": "SESSION",
      "identifier": "run-1791215372413"
    }
  ],
  "status": "SUBMITTED",
  "payload": {
    "masterSpecificationArtifactId": "art-spec",
    "sprintNumber": 1,
    "goals": [
      "Update project documentation (README.md and USAGE.md) to reflect current state",
      "Generate and execute commit for all uncommitted work"
    ],
    "tasks": [
      {
        "id": "TASK-1",
        "title": "Review uncommitted changes and update README.md",
        "requirementIds": [
          "REQ-DOC-001"
        ]
      },
      {
        "id": "TASK-2",
        "title": "Update USAGE.md with current usage instructions",
        "requirementIds": [
          "REQ-DOC-002"
        ]
      },
      {
        "id": "TASK-3",
        "title": "Craft conventional commit message and commit all changes",
        "requirementIds": [
          "REQ-COMMIT-001"
        ]
      }
    ],
    "acceptanceCriteria": [
      {
        "id": "AC-001",
        "statement": "README.md accurately describes current project state and recent changes"
      },
      {
        "id": "AC-002",
        "statement": "USAGE.md provides correct, up-to-date usage instructions"
      },
      {
        "id": "AC-003",
        "statement": "Commit message follows conventional commit format and summarizes all changes"
      },
      {
        "id": "AC-004",
        "statement": "All uncommitted work is properly staged and committed"
      },
      {
        "id": "AC-005",
        "statement": "git status shows clean working tree after commit"
      }
    ]
  }
}