{
  "artifactId": "art-sprintspecification-1791200527382",
  "artifactType": "SprintSpecification",
  "schemaVersion": "1.0.0",
  "workflowId": "pirunner-canonical",
  "taskId": "task-PLANNING",
  "agentId": "2103",
  "createdAt": "2026-10-05T11:42:07.382Z",
  "parentArtifactIds": [],
  "sourceRefs": [
    {
      "type": "SESSION",
      "identifier": "run-1791200527382"
    }
  ],
  "status": "SUBMITTED",
  "payload": {
    "masterSpecificationArtifactId": "art-spec-pirunner-docs",
    "sprintNumber": 1,
    "goals": [
      "Update PiRunner documentation to reflect the complete set of interactive slash commands and correct workflow advancement descriptions"
    ],
    "tasks": [
      {
        "id": "TASK-1",
        "title": "Add missing /hitm-conflict command to README.md slash commands table",
        "requirementIds": [
          "REQ-DOC-001"
        ]
      },
      {
        "id": "TASK-2",
        "title": "Add missing /hitm-conflict command to USAGE.md commands quick reference",
        "requirementIds": [
          "REQ-DOC-001"
        ]
      },
      {
        "id": "TASK-3",
        "title": "Clarify project adoption flow in USAGE.md Step 1 to show progression through KNOWLEDGE_SYNC",
        "requirementIds": [
          "REQ-DOC-002"
        ]
      },
      {
        "id": "TASK-4",
        "title": "Correct KNOWLEDGE_SYNC advancement target in USAGE.md Step 3 from SPRINT_READY to SPRINT_READY (transition T-031)",
        "requirementIds": [
          "REQ-DOC-002"
        ]
      }
    ],
    "acceptanceCriteria": [
      {
        "id": "AC-001",
        "statement": "README.md slash commands table includes /hitm-conflict with accurate description"
      },
      {
        "id": "AC-002",
        "statement": "USAGE.md commands quick reference includes /hitm-conflict with accurate description"
      },
      {
        "id": "AC-003",
        "statement": "USAGE.md Step 1 accurately describes the adoption flow: PROJECT_DISCOVERY → PROJECT_INTAKE → PROJECT_BASELINE → KNOWLEDGE_SYNC → PLANNING"
      },
      {
        "id": "AC-004",
        "statement": "USAGE.md Step 3 correctly describes KNOWLEDGE_SYNC advancement per transition registry T-031"
      }
    ]
  }
}