{
  "artifactId": "art-knowledgesnapshot-1791279049173",
  "artifactType": "KnowledgeSnapshot",
  "schemaVersion": "1.0.0",
  "workflowId": "pirunner-canonical",
  "taskId": "task-KNOWLEDGE_SYNC",
  "agentId": "0048",
  "createdAt": "2026-10-06T09:30:49.173Z",
  "parentArtifactIds": [],
  "sourceRefs": [
    {
      "type": "SESSION",
      "identifier": "run-1791279049172"
    }
  ],
  "status": "SUBMITTED",
  "payload": {
    "sourceRevision": "1bfe79e62862bd5ab98151dda5e9ac2a345a9906",
    "dependencyLockHash": "97c4bab5e9a3bfe277322fbb497191fdb2f7999f8fc68e8ad87aaacef9c77dc5",
    "verifiedAt": "2026-10-06T09:27:51.000Z",
    "freshnessPolicyVersion": "1.0.0",
    "relevantSourceFiles": [
      {
        "path": "src/extension.ts",
        "contentHash": "32bdd147675add6a10633a4a4e03e1698b0b785ff32611109d20b90296e144dd",
        "language": "typescript"
      },
      {
        "path": "src/index.ts",
        "contentHash": "a78fd7bf28a51caa753d8524181af136dd93e20c245dfba32811ac347e267cbb",
        "language": "typescript"
      },
      {
        "path": "src/application/WorkflowController.ts",
        "contentHash": "ea4a25e569be72fca4c29c3ecc3a6c139d9c1e134ece6c72e49afe02cad7a3c0",
        "language": "typescript"
      },
      {
        "path": "src/domain/workflow/WorkflowReducer.ts",
        "contentHash": "5ca943f4df80bd7c3f9e88a5d2ae67c72c5eaebcafed4271e3bc1c97a881ba78",
        "language": "typescript"
      },
      {
        "path": "src/domain/workflow/WorkflowTransition.ts",
        "contentHash": "aa0e0938a8ae5d06e8b2c87111684342c0305343547ccfed4417c57b01a7689e",
        "language": "typescript"
      },
      {
        "path": "src/domain/workflow/WorkflowState.ts",
        "contentHash": "ad75672f50f5065bab53c0df837eb94967fc35857929a1bc9ddebca098061201",
        "language": "typescript"
      },
      {
        "path": "src/domain/workflow/WorkflowIdentity.ts",
        "contentHash": "3fd8ad5d68cba52fa6e97db9ec4f2c321e04180bdc2427b57c81f0e286083da0",
        "language": "typescript"
      },
      {
        "path": "src/domain/project/ProjectDiscovery.ts",
        "contentHash": "804c008e315bc185ab37b3471aa87e16a4504b2519cd2d0200801c2e1eb252f9",
        "language": "typescript"
      },
      {
        "path": "src/domain/project/StateRecovery.ts",
        "contentHash": "31e500a28bb459169fbdf6922a90ebf3ba7edd99d09a6ea1438556b2c3485355",
        "language": "typescript"
      },
      {
        "path": "src/domain/project/StateValidation.ts",
        "contentHash": "a221e4fd0847313954f0751d6f6ac71bf6bcfc3c616ed60ab81c74b0ec2d7eb5",
        "language": "typescript"
      }
    ],
    "relevantSymbols": [
      {
        "name": "hitmHarnessExtension",
        "kind": "function",
        "location": {
          "path": "src/extension.ts",
          "line": 33,
          "column": 0
        },
        "exported": true
      },
      {
        "name": "resolveWorkflowIdentity",
        "kind": "function",
        "location": {
          "path": "src/extension.ts",
          "line": 47,
          "column": 0
        },
        "exported": false
      },
      {
        "name": "startNewWorkflow",
        "kind": "function",
        "location": {
          "path": "src/extension.ts",
          "line": 89,
          "column": 0
        },
        "exported": false
      },
      {
        "name": "archiveOldWorkflow",
        "kind": "function",
        "location": {
          "path": "src/extension.ts",
          "line": 127,
          "column": 0
        },
        "exported": false
      }
    ],
    "dependencies": [
      {
        "name": "ajv",
        "version": "^8.17.1",
        "resolved": "8.20.0",
        "ecosystem": "npm",
        "manifestPath": "package.json"
      },
      {
        "name": "ajv-formats",
        "version": "^3.0.1",
        "resolved": "3.0.1",
        "ecosystem": "npm",
        "manifestPath": "package.json"
      },
      {
        "name": "typescript",
        "version": "^5.5.0",
        "resolved": "5.9.3",
        "ecosystem": "npm",
        "manifestPath": "package.json"
      },
      {
        "name": "vitest",
        "version": "^2.0.0",
        "resolved": "2.1.9",
        "ecosystem": "npm",
        "manifestPath": "package.json"
      },
      {
        "name": "@types/node",
        "version": "^20.14.0",
        "resolved": "20.19.43",
        "ecosystem": "npm",
        "manifestPath": "package.json"
      }
    ],
    "documentationRefs": [
      {
        "identifier": "TECHSPEC.md",
        "title": "HITM-Orchestrated Multi-Agent Engineering Workflow - Technical Specification",
        "retrievedAt": "2026-10-06T09:27:51.000Z"
      },
      {
        "identifier": "README.md",
        "title": "PiRunner README",
        "retrievedAt": "2026-10-06T09:27:51.000Z"
      },
      {
        "identifier": "USAGE.md",
        "title": "PiRunner Usage Guide",
        "retrievedAt": "2026-10-06T09:27:51.000Z"
      }
    ],
    "notes": "Incremental knowledge delta synchronized. Changed: src/extension.ts (workflow identity and archival logic refactoring, +39/-31). 4 new baseline artifact files in .hitm/artifacts/. Source revision 1bfe79e6. Dependency lock hash 97c4bab5. 44 TypeScript source files audited."
  }
}