{
  "artifactId": "art-knowledgesnapshot-1791280465617",
  "artifactType": "KnowledgeSnapshot",
  "schemaVersion": "1.0.0",
  "workflowId": "pirunner-canonical",
  "taskId": "task-KNOWLEDGE_SYNC",
  "agentId": "0048",
  "createdAt": "2026-10-06T09:54:25.617Z",
  "parentArtifactIds": [],
  "sourceRefs": [
    {
      "type": "SESSION",
      "identifier": "run-1791280465617"
    }
  ],
  "status": "SUBMITTED",
  "payload": {
    "sourceRevision": "6ec253f358ad42480e880d2286f0a7091c6f2d27",
    "dependencyLockHash": "97c4bab5e9a3bfe277322fbb497191fdb2f7999f8fc68e8ad87aaacef9c77dc5",
    "verifiedAt": "2026-10-06T09:53:20.000Z",
    "freshnessPolicyVersion": "1.0.0",
    "relevantSourceFiles": [
      {
        "path": "src/extension.ts",
        "contentHash": "c4eb43d621cbbcf16873dab77af7a04d1145ba2afe108ae8e2823cab4df14ca3",
        "language": "typescript"
      },
      {
        "path": "src/domain/project/ProjectDiscovery.ts",
        "contentHash": "804c008e315bc185ab37b3471aa87e16a4504b2519cd2d0200801c2e1eb252f9",
        "language": "typescript"
      },
      {
        "path": "src/application/WorkflowController.ts",
        "contentHash": "ea4a25e569be72fca4c29c3ecc3a6c139d9c1e134ece6c72e49afe02cad7a3c0",
        "language": "typescript"
      },
      {
        "path": "tests/domain/workflow/WorkflowLifecycle.test.ts",
        "contentHash": "408e7964bf5b29f9a867970529ec9690f9da2b5a41b2bd00cbad94f1aa91230c",
        "language": "typescript"
      }
    ],
    "relevantSymbols": [
      {
        "name": "hitmHarnessExtension",
        "kind": "function",
        "location": {
          "path": "src/extension.ts",
          "line": 29,
          "column": 0
        },
        "exported": true
      }
    ],
    "dependencies": [
      {
        "name": "vitest",
        "version": "^2.0.0",
        "resolved": "2.1.9",
        "ecosystem": "npm",
        "manifestPath": "package.json"
      },
      {
        "name": "typescript",
        "version": "^5.5.0",
        "resolved": "5.9.3",
        "ecosystem": "npm",
        "manifestPath": "package.json"
      },
      {
        "name": "@types/node",
        "version": "^20.14.0",
        "resolved": "20.19.43",
        "ecosystem": "npm",
        "manifestPath": "package.json"
      },
      {
        "name": "ajv",
        "version": "^8.17.1",
        "resolved": "8.20.0",
        "ecosystem": "npm",
        "manifestPath": "package.json"
      },
      {
        "name": "ajv-formats",
        "version": "^3.0.1",
        "resolved": "3.0.1",
        "ecosystem": "npm",
        "manifestPath": "package.json"
      }
    ],
    "documentationRefs": [
      {
        "identifier": "TECHSPEC.md",
        "title": "TECHSPEC.md",
        "retrievedAt": "2026-10-06T09:53:20.000Z"
      }
    ],
    "notes": "Incremental knowledge delta synchronized. Recent fixes: human approval propagation in agent_end HITM promotion path, workflow lifecycle archival/restartability, discovery identity awareness (Sprint 8 P0 closures)."
  }
}