{
  "artifactId": "art-sprintspecification-1791291936215",
  "artifactType": "SprintSpecification",
  "schemaVersion": "1.0.0",
  "workflowId": "pirunner-1791291743088-raeprq",
  "taskId": "task-PLANNING",
  "agentId": "0036",
  "createdAt": "2026-10-06T13:05:36.215Z",
  "parentArtifactIds": [],
  "sourceRefs": [
    {
      "type": "SESSION",
      "identifier": "run-1791291936215"
    }
  ],
  "status": "SUBMITTED",
  "payload": {
    "masterSpecificationArtifactId": "art-spec",
    "sprintNumber": 1,
    "goals": [
      "Answer all 11 verification questions through implementation, testing, and documentation",
      "Validate PiRunner's test specification lifecycle end-to-end",
      "Verify artifact provenance, hash integrity, and event immutability"
    ],
    "tasks": [
      {
        "id": "TASK-1",
        "title": "Implement and verify TestSpecification creation and acceptance (Q1)",
        "requirementIds": [
          "REQ-Q1"
        ]
      },
      {
        "id": "TASK-2",
        "title": "Verify TestSpecification contains testSuiteContentHash field (Q2)",
        "requirementIds": [
          "REQ-Q2"
        ]
      },
      {
        "id": "TASK-3",
        "title": "Verify TestSuiteLock references the exact accepted TestSpecification artifact (Q3)",
        "requirementIds": [
          "REQ-Q3"
        ]
      },
      {
        "id": "TASK-4",
        "title": "Compute and verify live hash equals the locked hash (Q4)",
        "requirementIds": [
          "REQ-Q4"
        ]
      },
      {
        "id": "TASK-5",
        "title": "Verify authoritative execution uses the command from TestSpecification (Q5)",
        "requirementIds": [
          "REQ-Q5"
        ]
      },
      {
        "id": "TASK-6",
        "title": "Verify TestExecutionResult references specification, hash, command, and repository revision (Q6)",
        "requirementIds": [
          "REQ-Q6"
        ]
      },
      {
        "id": "TASK-7",
        "title": "Implement real Pi agent artifact emission and ingestion without synthetic provenance (Q7)",
        "requirementIds": [
          "REQ-Q7"
        ]
      },
      {
        "id": "TASK-8",
        "title": "Test and verify unauthorized Pi tool call blocking (Q8)",
        "requirementIds": [
          "REQ-Q8"
        ]
      },
      {
        "id": "TASK-9",
        "title": "Test workflow restart recovery to identical canonical state (Q9)",
        "requirementIds": [
          "REQ-Q9"
        ]
      },
      {
        "id": "TASK-10",
        "title": "Test deliberate repository mutation producing conflict/HUMAN_GATE (Q10)",
        "requirementIds": [
          "REQ-Q10"
        ]
      },
      {
        "id": "TASK-11",
        "title": "Verify PRESERVE append only adds evidence without modifying historical events (Q11)",
        "requirementIds": [
          "REQ-Q11"
        ]
      }
    ],
    "acceptanceCriteria": [
      {
        "id": "AC-Q1",
        "statement": "PiRunner successfully creates and accepts a TestSpecification artifact describing the current test suite"
      },
      {
        "id": "AC-Q2",
        "statement": "The accepted TestSpecification artifact contains a valid testSuiteContentHash field"
      },
      {
        "id": "AC-Q3",
        "statement": "The generated TestSuiteLock references the exact TestSpecification artifact ID"
      },
      {
        "id": "AC-Q4",
        "statement": "The computed live hash of the test suite matches the locked hash in TestSuiteLock"
      },
      {
        "id": "AC-Q5",
        "statement": "The authoritative test execution invokes the exact command specified in TestSpecification"
      },
      {
        "id": "AC-Q6",
        "statement": "TestExecutionResult artifact contains references to specification ID, hash, command, and repository revision"
      },
      {
        "id": "AC-Q7",
        "statement": "Real Pi agent emits artifacts that are successfully ingested without requiring synthetic provenance"
      },
      {
        "id": "AC-Q8",
        "statement": "Unauthorized real Pi tool calls are detected and blocked"
      },
      {
        "id": "AC-Q9",
        "statement": "Workflow restart recovers to the same canonical state with matching state hash"
      },
      {
        "id": "AC-Q10",
        "statement": "Deliberate repository mutation produces expected conflict detection and HUMAN_GATE state transition"
      },
      {
        "id": "AC-Q11",
        "statement": "PRESERVE operation appends new events without modifying historical event content or order"
      }
    ]
  }
}